company,position,skill
(주)사이버다임,DCS개발본부 Java 개발자 (신입) 모집,"기술지원, 백엔드/서버개발, 웹개발, 프론트엔드, SI개발 외 수정일 25/04/03"
(주)하이퍼에픽,신입 개발자 채용,"백엔드/서버개발, 웹개발, 퍼블리셔, 프론트엔드, DBA 외 등록일 25/04/17"
(주)트랜스코스모스코리아,[여의도] 당사 CX개발4부 개발자 신규 채용 MQq4,"기술지원, 백엔드/서버개발, 앱개발, 웹개발, 유지보수 외 등록일 25/04/14"
(주)트랜스코스모스코리아,[여의도] 당사 CX개발4부 개발자 신규 채용 MQq4,"기술지원, 백엔드/서버개발, 앱개발, 웹개발, 유지보수 외 수정일 25/04/15"
(주)인스웨이브,[풀스택 개발자] 백엔드/서버개발 경력직 모집,"백엔드/서버개발, 웹개발, 프론트엔드, HTML, HTML5 외 수정일 25/04/03"
(주)숲,"[SOOP 자회사] ㈜프리캡 서비스 개발자 (웹서비스, 블록체인)","백엔드/서버개발, 웹개발, 프론트엔드, 반응형웹, 블록체인 외 등록일 25/04/16"
(주)인젠트,"[인젠트]DDM사업팀- Java, Jsp 웹개발자 채용","백엔드/서버개발, 웹개발, 퍼블리셔, 솔루션, DBMS 외 수정일 25/04/09"
(주)인피닉,Backend팀 개발자 채용,"백엔드/서버개발, 웹개발, SE, 시스템엔지니어, 클라우드, Docker 외 등록일 25/04/08"
씨엔티테크(주),씨엔티테크(주) 백엔드 신입 개발자 채용,"백엔드/서버개발, Java, NoSQL, SpringBoot, 소프트웨어개발 등록일 25/04/11"
(주)엠젠솔루션,[엠젠솔루션] AI융합연구소 Web Front/Back 개발자 채용 공고,"기술지원, 데이터엔지니어, 백엔드/서버개발, 유지보수, 프론트엔드 외 수정일 25/04/10"
크리니티(주),[개발자 채용] 솔루션 구축 및 프로젝트 수행,"백엔드/서버개발, 웹개발, 정보보안, 퍼블리셔, 프론트엔드 외 등록일 25/03/25"
넥스트리(주),SW 신입 개발자 채용 신입 모집(정규직),"백엔드/서버개발, 웹개발, 프론트엔드, SI, 시스템통합, 솔루션업체 외 등록일 25/03/26"
상상스토리(주),[상상스토리(주)] 신입개발자 추가 채용 공고,"백엔드/서버개발, 앱개발, 웹개발, 유지보수, 프론트엔드 외 등록일 25/04/02"
(주)트윔,선행연구팀 프론트엔드 개발자 채용,"딥러닝, 머신러닝, 빅데이터, 솔루션, 알고리즘 외 등록일 25/04/14"
(주)이카운트,2025년 AI 개발자 경력직 채용,"기술지원, 데이터분석가, 데이터엔지니어, 백엔드/서버개발, 프론트엔드 외 수정일 25/04/17"
(주)에스케어,"[ESCARE] JAVA, Spring 개발자","RDBMS, Java, JSP, MariaDB, NoSQL 외 수정일 25/04/03"
(주)이트리즈시스템,JAVA 기반 웹 개발자(SI/SM) 신입 채용,"백엔드/서버개발, 웹개발, 프론트엔드, Ajax, Java 외 등록일 25/04/15"
(주)아이티엘,엔터프라이즈 웹서비스 개발자 채용,"웹개발, 풀스택, IT컨설팅 등록일 25/02/17"
(주)오스랩스,웹(Back-end) 개발자 모집,"백엔드/서버개발, 웹개발, API, Java, Javascript 외 등록일 25/02/28"
(주)텍트원,JAVA JSP Springframe egov 개발자 경력[안양],"백엔드/서버개발, 웹개발, 웹마스터, 프론트엔드, SI개발 외 등록일 25/04/01"
(주)불스원,불스원 IT팀 경력 웹개발자 채용,"백엔드/서버개발, 웹개발, 유지보수, 석유화학, 화학 외 등록일 25/04/11"
(주)아이에스티엔,(주)ISTN [ SAP UI5 /BTP/ABAP 개발자 채용],"앱개발, 웹개발, 프론트엔드, 솔루션, API 외 등록일 25/04/10"
(주)에이아이프로,웹 프론트엔드 개발자 - 신입/경력,"프론트엔드, 반응형웹, 소프트웨어개발 수정일 25/04/15"
(주)비하베스트,backend 개발자 채용,"데이터분석가, 데이터엔지니어, 백엔드/서버개발, 웹개발, 웹마스터 외 수정일 25/04/16"
피씨엔오티(주),PLC제어 • 전장 설계 및 제작 • S/W 개발자 및 Set-Up 채용,"컴퓨터비전, 펌웨어, S/W, C, C++ 외 수정일 25/04/17"
(주)나인기획,플랫폼 개발자(Vue.js) 채용,"기술지원, 데이터분석가, 데이터엔지니어, 백엔드/서버개발, 앱개발 외 수정일 25/04/07"
(주)즐거움을더하다,마케팅 기획/UIUX 디자인/개발자 채용,"기술지원, 백엔드/서버개발, 앱개발, 웹개발, 프론트엔드 외 수정일 25/04/16"
(주)쇼엠,[인천 송도 근무] 파이썬 개발자 사원 채용,"기술지원, 백엔드/서버개발, 앱개발, 웹개발, 웹마스터 외 수정일 25/03/31"
(주)편한가,풀스택 주니어 개발자 채용,"데이터분석가, 데이터엔지니어, 백엔드/서버개발, 앱개발, 웹개발 외 수정일 25/04/09"
(주)리드넘버,[리드넘버] 프론트 개발자 채용 [경력무관],"앱개발, 웹개발, 유지보수, 프론트엔드, 핀테크 외 등록일 25/04/15"
(주)플랜티엠,[판교] - 프론트엔드 개발자 채용,"기술지원, 백엔드/서버개발, 웹개발, 퍼블리셔, 프론트엔드 외 수정일 25/03/19"
(주)인공지능팩토리,IT 개발자 신입 채용,"데이터분석가, 백엔드/서버개발, 웹개발, 프론트엔드, 딥러닝 외 등록일 25/03/25"
(주)딥아이,[딥아이] WEB 개발자(Frontend / Backend Developer) 모집,"웹개발, 프론트엔드, 반응형웹, 웹표준, 웹접근성, 클라우드 외 등록일 25/04/10"
(주)에프엘이에스,웹서버 개발자 신입 채용,"백엔드/서버개발, 웹개발, 프론트엔드, C++, C언어 외 등록일 25/04/14"
(주)인공지능팩토리,IT 개발자 경력 채용,"데이터분석가, 백엔드/서버개발, 웹개발, 프론트엔드, 딥러닝 외 등록일 25/04/16"
(주)넥스트코어테크놀로지,열정 가득한 풀스택[Full-Stack] 개발자 모집,"백엔드/서버개발, 웹개발, 데이터시각화, 모델링, API 외 수정일 25/03/25"
(주)누리앱,[웹개발] JAVA 신입 개발자 (SI/SM 1팀),"백엔드/서버개발, 웹개발, 프론트엔드, Java, React 외 등록일 25/04/03"
(주)하이젠헬스케어,"Java 프로그램 기반 웹프로그래머, 웹개발자 채용","앱개발, 웹개발, Android, CSS, HTML 외 등록일 25/04/10"
(주)엠브레이스,[강소기업 엠브레이스] 프론트엔드 개발자 신입 채용,"프론트엔드, SI, 시스템통합, ERP, CRM, 솔루션업체 등록일 25/04/14"
(주)에스제이테크놀로지,[주 4.25일제] 2025년 경력 개발자 채용(자바 2년이상 ),"백엔드/서버개발, 웹개발, Java, Javascript, Spring 외 등록일 25/04/16"
(주)세인티,[신입/경력] Web 프론트엔드 개발자 모집,"React, ReactJS, Vue.js, Javascript, TypeScript 외 수정일 25/03/28"
(주)테크블루,웹 개발자(풀스택) 신입 채용,"프론트엔드, 백엔드/서버개발, 소프트웨어개발 수정일 25/04/16"
(주)다하미커뮤니케이션즈,웹 어플리케이션 개발 담당자 신입/경력 채용,"Spring, PostgreSQL, SpringBoot, Ajax, RestAPI 외 수정일 25/04/08"
바이엇(주),[프론트엔드] 신입 글로벌 웹개발자 채용,"유지보수, 퍼블리셔, 프론트엔드, 백엔드/서버개발, 웹개발 외 수정일 25/02/21"
(주)코보시스,서버 개발자,"Spring, SpringBoot, RestAPI, SQL, JSP 외 등록일 25/04/02"
아이파킹(주),클라우드 Java 백엔드 개발자 채용,"Java, NoSQL, 프론트엔드, Spring, SpringBoot 외 등록일 25/04/01"
(주)데이터유니버스,[신입/경력] Backend 개발자 채용,"Linux, MySQL, 백엔드/서버개발, 소프트웨어개발 등록일 25/04/07"
(주)베스티안소프트,[Java] JAVA & JSP 웹프로그램 개발자 모집,"React, Java, 풀스택, 프론트엔드, Spring 외 수정일 25/04/01"
(주)엔코디,Full-stack 개발자 모집 - 정규직,"유지보수, 백엔드/서버개발, IT컨설팅, 소프트웨어개발 수정일 25/04/17"
(주)인피닉,Backend팀 개발자 채용,"SE, 시스템엔지니어, 클라우드, Java, Docker, 백엔드/서버개발 외 등록일 25/04/08"
(주)인피닉,[인피닉] 인공지능 연구소 AI서비스실 Frontend팀 개발자 채용,"프론트엔드, 웹개발, 소프트웨어개발 등록일 25/04/09"
(주)소프트아이텍,공공 부문 응용시스템 JAVA 개발자(경력 3년 이상) 모집,"유지보수, Spring, SpringBoot, SQL, Python 외 수정일 25/04/17"
(주)파이오링크,[코스닥 상장사] 전문연구요원 어플리케이션 및 클라우드 개발자,"Git, GoLang, Linux, C++, Python 외 수정일 25/04/10"
(주)모은넷,기술연구소 SW개발자 채용 (JAVA/C#/.NET)(신입/경력),"SQL, Android, HTML5, IIS, ASP 외 수정일 25/04/17"
(주)슈프리마,웹서버 개발자 모집,"React, Java, ReactJS, C++, C언어 외 수정일 25/04/03"
(주)사이버다임,"연구소 서버개발팀 개발자 (신입, 경력) 모집","알고리즘, React-Native, DLP, Java, Eclipse 외 수정일 25/04/03"
(주)소프트넷,JAVA 개발자 채용,"Spring, SpringBoot, RestAPI, SQL, Angular 외 등록일 25/04/11"
(주)네오비젼,솔루션 관리 · 개발 지원 WEB 개발자 채용 공고,"React, MyBatis, Javascript, Spring, JSP 외 등록일 25/04/01"
(주)베스텔라랩,풀스택(Java) 개발자(전문연구요원가능),"Spring, SpringBoot, SQL, MariaDB, Java 외 등록일 25/03/25"
(주)대흥정보,[대흥정보] 웹개발자(Full stack) 신입/경력 채용,"SI개발, 웹개발, 소프트웨어개발 등록일 25/03/10"
(주)엑셈,C 개발자(3년 이상),"SE, 시스템엔지니어, Linux, 네트워크, C++, C언어 외 등록일 25/04/17"
에이치투오시스템테크놀로지(주),리눅스 C/C++ 백엔드 서버개발자,"Linux, C++, C언어, Unix, 아키텍쳐 외 등록일 25/04/07"
(주)코보시스,Flutter 개발자,"Objective-C, Android, Flutter, Kotlin, Swift 외 등록일 25/04/02"
(주)넥서스커뮤니티,Web 개발자 채용,"Spring, SpringBoot, Git, React, Java 외 등록일 25/03/26"
(주)아이나비시스템즈,[아이나비시스템즈] 백엔드 개발자(Kotlin/Java) 상시 채용,"Kotlin, S/W, AWS, Java, Linux 외 등록일 25/03/28"
(주)엔에스솔루션,[경력무관] 프론트 웹 개발자 모집(정규직),"CSS3, React, 반응형웹, React-Native, ReactJS 외 등록일 25/04/02"
(주)트윔,선행연구팀 프론트엔드 개발자 채용,"풀스택, 자동화라인, SQL, Python, H/W 외 등록일 25/04/14"
(주)아이디에스앤트러스트,포탈 웹사이트 Back-end 개발자 경력직,"Spring, SpringBoot, SQL, Python, Kotlin 외 등록일 25/04/03"
주식회사 키토스,개발자 신입/경력직 모집 공고 (정규직),"C, Python, ERP, OracleDB, SM 등록일 25/03/11"
(주)아이티센클로잇,[아이티센클로잇] Java·.NET·Flutter 개발자 / SaaS 분야 담당,"GCP, 클라우드, 인프라, 데이터엔지니어, SM 수정일 25/04/15"
(주)다이퀘스트,[다이퀘스트] 프론트엔드 개발자 경력직 모집,"Javascript, AI, 인공지능, CSS, 웹개발, IT컨설팅 외 수정일 25/04/16"
(주)윌코모시스템즈,소프트웨어 개발자(프로그래머) 신입사원 채용,"앱개발, 종합포털 수정일 25/04/10"
오엠티아이코리아(주),[신입] ASP.NET 개발자 모집,".NET, ASP, CSS3, ASP.NET, 반응형웹 외 등록일 25/04/07"
(주)신지넷,JAVA및 응용프로그램 개발자 정직원 채용(경력직) - 4~8년,"Spring, Redux, ASP, React, React-Native 외 등록일 25/04/15"
(주)아이젝스,Mac Agent 파이썬 개발자/안드로이드&ios 개발자 채용 공고,"iOS, MacOS, Android, Python, 소프트웨어개발 수정일 25/04/15"
주식회사비큐에이아이,서비스개발본부 백엔드개발팀 백엔드개발자,"백엔드/서버개발, DBA, 소프트웨어개발 수정일 25/04/01"
(주)딥노이드,[보안AI사업본부] 백엔드 개발자_경력,"SE, 시스템엔지니어, Kotlin, 클라우드, Docker, NoSQL 외 등록일 25/04/01"
(주)대흥정보,C# 개발자 채용,"ASP.NET, C, C++, C언어, 소프트웨어개발 등록일 25/03/10"
(주)아이오코드,(주)아이오코드 경력 개발자 채용,"ASP.NET, MSSQL, Java, 빅데이터, C, 외 등록일 25/03/31"
유니원아이앤씨(주),[경력] 프론트엔드 개발자 모집 - 대리급(3년이상),"프론트엔드, 앱개발, DBMS 등록일 25/02/18"
(주)텍트원,JAVA JSP Springframe egov 개발자 경력[안양],"웹마스터, Spring, PostgreSQL, Ajax, SQL 외 등록일 25/04/01"
(주)라닉스,웹개발자 (Front End),"Spring, SpringBoot, Objective-C, Android, Python 외 등록일 25/03/19"
(주)인공지능팩토리,IT 개발자 경력 채용,"Spring, SpringBoot, AWS, Java, 블록체인 외 등록일 25/04/16"
(주)상록아이엔씨,"[긴급] 웹개발자 모집 (jsp,java)","Spring, SpringBoot, JSP, React, Java 외 수정일 25/01/10"
(주)아이에스티엔,(주)ISTN [ SAP UI5 /BTP/ABAP 개발자 채용],"SAP, AWS, ReactJS, Javascript, Node.js 외 등록일 25/04/10"
(주)엘컴텍,[프론트 엔드]경력 3년 이하 웹 서비스 개발자,"웹개발, 소프트웨어개발 수정일 25/04/01"
(주)슈프리마,[슈프리마] 웹서버 개발자 모집,"Java, C++, Spring, 전자 등록일 25/04/03"
(주)인피닉,[인피닉] 인공지능 연구소 AI서비스실 Backend팀 개발자 채용,"백엔드/서버개발, 소프트웨어개발 수정일 25/04/08"
(주)이너인포,[JAVA 백엔드 개발자] 경력직 채용 공고,"SI개발, jQuery, Spring, SpringBoot, 백엔드/서버개발 외 등록일 25/03/31"
(주)엔유비즈,경력개발자 모집 : 웹(JAVA/Spring/React),"React, Java, TypeScript, SpringBoot, JSP 외 수정일 25/04/01"
(주)메타덱스터,[풀스택개발자] 솔루션 개발 경력직 채용,"웹개발, 소프트웨어개발 수정일 25/02/26"
(주)모멘티,(주)모멘티 풀스택 개발자 채용 [강남구/경력],"Flutter, React, React-Native, Vue.js, 프론트엔드 외 등록일 25/03/27"
(주)유니포인트,[유니포인트] 기술연구소 JAVA개발자 채용,"웹마스터, 유지보수, Spring, SpringBoot, HTTP 외 수정일 25/03/20"
(주)아이링크시스템,프로그램 개발자 상시채용공고,"Java, Linux, Javascript, C++, 솔루션 외 등록일 25/03/04"
(주)넥스트코어테크놀로지,열정 가득한 풀스택[Full-Stack] 개발자 모집,"모델링, 쉘스크립트, React, Java, Javascript 외 수정일 25/03/25"
(주)티피씨인터넷,안드로이드 개발자,"Kotlin, Android, 앱개발, 소프트웨어개발 수정일 25/04/16"
(주)솔게이트,JAVA 웹/프로세스 초급 개발자 모십니다.,"React, Java, 풀스택, 프론트엔드, 백엔드/서버개발 외 등록일 25/03/31"
(주)엠젠솔루션,[엠젠솔루션] AI융합연구소 Web Front/Back 개발자 채용 공고,"유지보수, 정보통신, GIS, React, Java 외 수정일 25/04/10"
아이파킹(주),iOS APP 개발자 채용,"Flutter, Kotlin, Swift, iOS, Objective-C 외 등록일 25/04/01"
비즈톡(주),웹 서비스 자바 개발자,"SE, 시스템엔지니어, Java, Linux, C++, C언어 외 등록일 25/03/19"
(주)코코에이치,백엔드 / 서버 개발자 및 풀스택 개발자 모집 공고,"웹마스터, 백엔드/서버개발, 앱개발, 웹개발, 소프트웨어개발 등록일 25/03/31"
(주)소통파이브,JAVA(Spring/eGOV) 신입 개발자 채용,"Java, Spring, JSP, 웹개발, 백엔드 외 수정일 25/04/10"
(주)마상소프트,"[부산] 웹 개발자(백엔드, 프론트)","웹개발, 게임 등록일 25/04/15"
(주)사이버이메지네이션,[사이버이메지네이션] 솔루션 개발 및 유지보수 담당자 모집,"Java, 백엔드/서버개발, 웹개발, API, SM 등록일 25/03/21"
(주)노르마,[노르마]각 부문별 개발자 채용,"Python, Pytorch, RDBMS, VPN, IoT 외 등록일 25/02/25"
(주)모비루스,"SW 개발자 신입 [Android, C, C++, QT]","Qt, 임베디드리눅스, S/W, Git, MCU 외 등록일 25/04/11"
(주)인스웨이브,[풀스택 개발자] 백엔드/서버개발 경력직 모집,"Java, Javascript, 프론트엔드, HTML, XML 외 수정일 25/04/03"
(주)이젬코,[이젬코] ICT사업본부 개발자 신입 및 경력직 모집 [C#],".NET, API, SI개발, IoT, S/W 외 등록일 25/04/10"
굿어스데이터(주),개발 담당자(신입/경력),"클라우드, Javascript, 솔루션, Spring, Python 외 등록일 25/04/07"
(주)아이웨이,2025년 (주)아이웨이 개발(JAVA개발자) 경력 및 신입 모집 공고,"SI개발, 프론트엔드, 백엔드/서버개발, SM 등록일 25/03/27"
(주)세나테크놀로지,백엔드(서버) 개발자 채용,"SE, 시스템엔지니어, Git, AWS, 클라우드, Docker 외 등록일 25/04/11"
(주)지비소프트,백엔드(JAVA 웹 애플리케이션) 개발자 채용 (대구본사 근무),"유지보수, AI, 인공지능, Spring, 헬스케어, SpringBoot 외 수정일 25/02/28"
(주)한국정보공작소,[정규직] JAVA 경력직 개발자를 모십니다.,"Java, 프론트엔드, HTML, 백엔드/서버개발, 웹개발 외 등록일 25/04/09"
(주)티젠소프트,"[2025년 개발팀 공채] JAVA, JSP 개발자 신입,경력 모집","Java, 솔루션, Spring, JSP, 소프트웨어개발 등록일 25/03/06"
투아이시스(주),투아이시스(주) 프론트엔드 개발자 경력직 모집,"SVN, CSS3, React, Java, Linux 외 수정일 25/04/16"
(주)온넷시스템즈코리아,Android / iOS 모바일 애플리케이션 개발자 채용,"Flutter, Kotlin, Swift, Git, React 외 수정일 25/03/28"
(주)엑셈,[코스닥상장사]Java 백엔드 개발자 채용(1년 이상),"Java, Spring, PostgreSQL, SpringBoot, 백엔드/서버개발 외 등록일 25/04/10"
(주)엠에스링크앤솔루션,"[성수역] JAVA,JSP,React 개발자 모집 (신입)","SI개발, React, Java, ReactJS, 크로스플랫폼 외 등록일 25/02/24"
(주)비아이매트릭스,[코스닥기업] 기술연구소 개발자 채용,"웹개발, 솔루션업체 등록일 25/04/17"
(주)닷코,(주)닷코 풀스택 개발자 채용,"웹마스터, 유지보수, 보안관제, 사업기획, 빅데이터 외 등록일 25/04/04"
(주)아이비즈소프트웨어,[프론트엔드] JAVA 개발자 채용,"SI개발, React, AWS, ReactJS, Node.js 외 등록일 25/04/01"
수퍼빈(주),APP 개발자 모집,"개발PM, 로봇엔지니어, R&D기획, 연구원, 백엔드/서버개발 외 등록일 25/04/17"
(주)사이버다임,서버개발팀 백엔드 개발자(경력),"Java, Spring, SpringBoot, 백엔드/서버개발, JSP 외 등록일 25/03/26"
(주)터전,풀스택 경력 개발자 채용,"React, Linux, MySQL, PHP, 백엔드/서버개발 외 수정일 25/04/14"
녹원정보기술(주),[백엔드 개발자] 3년 이상 경력자 채용,"Javascript, Node.js, 메타버스, 백엔드/서버개발, MariaDB 외 등록일 25/04/10"
아주큐엠에스(주),Java 개발자 책임급,"MSSQL, Java, Javascript, ECMAScript, jQuery 외 등록일 25/04/08"
(주)지트,미래를 함께할 JAVA 개발자 경력 사원 채용,"Java, Ajax, 웹개발, OracleDB, SM 등록일 25/04/07"
(주)대건소프트,[S/W] (주)대건소프트 개발자 신입/경력사원 채용,"유지보수, Python, 정보통신, H/W, 알고리즘 외 등록일 25/04/01"
주식회사 스타랩스,[스타랩스] Web개발 경력자 채용,"MSSQL, Java, Linux, Javascript, 퍼블리셔 외 수정일 25/04/17"
한솔코에버(주),Web개발자(중급) / ERP 개발자 채용,"웹개발, 소프트웨어개발 수정일 25/03/24"
(주)넥써쓰,Android 개발자[8~10년],"Kotlin, React-Native, 블록체인, 프론트엔드, Android 외 등록일 25/04/15"
(주)시아나,[정규직] JAVA/JSP개발자분을 모십니다.,"PaaS, SI개발, MSSQL, React, Java 외 등록일 25/04/15"
에이아이티스토리(주),에이아이티스토리 개발자 경력 채용 (웹개발 / AI / 퍼블),"웹디자인, React, Vue.js, Figma, 머신러닝 외 수정일 25/03/24"
(주)블루버드,SW 개발자 채용(Wifi 개발),"S/W, Android, 앱개발, framework, 통신 수정일 25/03/12"
(주)엠에스링크앤솔루션,"React, JAVA,JSP 개발자 모집 (경력)","SI개발, React, Java, ReactJS, 크로스플랫폼 외 등록일 25/02/25"
(주)모던텍,SW팀 웹/서버 경력개발자 정규직 채용(서울),"C, 백엔드/서버개발, 웹개발, 유지보수 수정일 25/04/02"
(주)모은넷,기술연구소 SW개발자 채용 (JAVA/C#/.NET),"SQL, Android, HTML5, IIS, ASP 외 수정일 25/04/17"
글로벌엠아이지,[경력/정규직] PHP Laravel 개발자 채용 - 주 5일,"반응형웹, 웹표준, 웹접근성, 개발PM, Javascript, HTML 외 수정일 25/02/24"
(주)베스텔라랩,App(React Native) 개발자(전문연구요원가능),"Spring, SpringBoot, Python, SE, 시스템엔지니어, Kotlin 외 등록일 25/03/25"
(주)세나테크놀로지,백엔드(서버) 개발자 채용,"백엔드/서버개발, 블루투스 수정일 25/04/11"
켐아이넷(주),"Python 개발자/ 자연어처리(NLP), 머신러닝, 딥러닝 개발자 모집","통계/분석, 빅데이터, 딥러닝, 연구원, 데이터분석가 외 등록일 25/04/03"
마준소프트(주),"IT 웹/서버, 클라우드 프로그램 개발자 모집(신입/경력)","Windows, Ajax, SQL, .NET, JSP 외 수정일 25/04/02"
(주)에프엘이에스,flutter 개발자 신입 채용,"Objective-C, Android, Flutter, SE, 시스템엔지니어, Swift 외 등록일 25/04/14"
(주)진코퍼레이션,2025-2차) C# 응용프로그램 개발자 채용,"MSSQL, C, WPF, .NET, SM 등록일 25/03/11"
(주)무브,MOVV 개발자 신규채용 [프론트엔드],"Javascript, TypeScript, 프론트엔드, 웹개발, 소프트웨어개발 등록일 25/03/25"
(주)대호이엔지,"IT 웹 개발자, 공간정보 개발자 모집(신입, 경력 무관)","React, Java, Javascript, Node.js, Eclipse 외 등록일 25/04/08"
이우솔루션,[모집분야] 웹 풀스택 개발자 채용,"풀스택, SI, 시스템통합 수정일 25/04/11"
(주)네비웍스,웹 개발자 경력직 채용(3년 이상),"SE, 시스템엔지니어, Git, Kubernetes, React, ReactJS 외 등록일 25/04/04"
(주)에이앤티솔루션,"JAVA / JSP / Spring, 웹개발자 경력 채용 (분당-유지보수)","Java, Eclipse, jQuery, 프론트엔드, XML 외 수정일 25/04/09"
(주)딥노이드,[보안AI사업본부] 프론트엔드 개발자,"React, ReactJS, Javascript, TypeScript, ECMAScript 외 등록일 25/04/01"
(주)벤디트,프론트엔드 개발자,"React, AWS, GraphQL, ReactJS, Javascript 외 등록일 25/04/14"
(주)넥써쓰,Android 개발자[2~4년],"Kotlin, React-Native, 블록체인, 프론트엔드, Android 외 등록일 25/04/15"
스마트케어웍스(주),[웹개발] Front-end Web 개발 경력자 채용,"MongoDB, ASP.NET, React, Javascript, C, 외 수정일 25/03/26"
㈜더아이엠씨,AI & Big Data 플랫폼 서비스 풀스택 웹/앱 개발자(신입/경력),"R, 텍스트마이닝, 빅데이터, 데이터마이닝, R&D 외 등록일 25/04/14"
(주)시어스랩,Flutter 앱 개발자 - 디지털트윈&스마트솔루션,"Flutter, iOS, 프론트엔드, RestAPI, Android 외 등록일 25/03/27"
솔루션코리아(주),"MES 시스템 개발자( JAVA, PHP ) 모집","개발PM, 백엔드/서버개발, 웹개발, 소프트웨어개발 수정일 25/04/07"
(주)슈프리마,[슈프리마] 얼굴인식 서버 풀스택 소프트웨어 개발자 모집,"S/W, C++, 풀스택, 프론트엔드, 백엔드/서버개발 외 등록일 25/04/09"
(주)비즈니스온커뮤니케이션,스마트빌 닷넷 개발자 모집(과/차장급),"유지보수, MSSQL, Javascript, C, 솔루션 외 등록일 25/04/15"
(주)사이버다임,서버개발팀 모바일 개발자(경력),"iOS, React-Native, Javascript, Node.js, ECMAScript 외 등록일 25/03/26"
(주)타임리,[주식회사 타임리] 백엔드 개발자 경력직 채용공고,"React, Java, MySQL, Node.js, RestAPI 외 등록일 25/04/07"
(주)엠에스링크앤솔루션,"[증미역] JAVA, React, 백엔드, 프론트엔드 개발자(경력) 채용","React, Java, 프론트엔드, 백엔드/서버개발, 소프트웨어개발 등록일 25/04/01"
슈어데이터랩(주),연구개발(프론트엔드개발자) 채용,"프론트엔드, 소프트웨어개발 등록일 25/04/14"
넥스트리(주),SW 신입 개발자 채용 신입 모집(정규직),"프론트엔드, 백엔드/서버개발, 웹개발, 소프트웨어개발 등록일 25/03/26"
(주)라임에스,"[신입] 웹 개발자 (java, spring, 전자정부프레임워크)","Git, React, Docker, Node.js, Jenkins 외 수정일 25/04/10"
(주)코아맥스테크놀로지,AI 인공지능 개발자 채용 공고,"SE, 시스템엔지니어, S/W, 방화벽, 네트워크, 정보보안 외 등록일 25/03/04"
미스터마인드(주),[판교] 백엔드 개발자 채용,"풀스택, Spring, .NET, MongoDB, Kubernetes 외 수정일 25/04/02"
(주)지비소프트,백엔드(JAVA 웹 애플리케이션) 개발자 경력직 채용,"유지보수, AI, 인공지능, Spring, 헬스케어, SpringBoot 외 등록일 25/02/27"
(주)와우인포텍,신입/경력 개발자 채용 (Java Web),"Java, 웹개발, OracleDB, 소프트웨어개발 등록일 25/04/01"
(주)알티넷솔루션,[자동화플랫폼팀] 연구소 Java 백앤드 개발자 채용,"솔루션, 백엔드/서버개발, 소프트웨어개발 수정일 25/04/04"
(주)에스제이테크놀로지,[주 4.25일제] 2025년 경력 개발자 채용(자바 2년이상 ),"Java, Vue.js, Javascript, Spring, SpringBoot 외 등록일 25/04/16"
(주)아이브,백엔드 개발자 (Backend Developer),"Redis, PostgreSQL, RDBMS, Kafka, SE, 시스템엔지니어, 외 등록일 25/03/28"
(주)커브,Java 개발자 정규직 모집 - 경력,"Java, 소프트웨어개발 등록일 25/04/04"
(주)에스비티글로벌,[Java 백엔드/프론트엔드 & ETL/DW/DM] 경력 개발자 모집,"DW, 프론트엔드, 백엔드/서버개발, ETL, OLAP 외 등록일 25/04/01"
