company,position,skill
엔쓰리엔(주),Frontend 개발자 (7~10년),"React, React-Native, ReactJS, Javascript, ECMAScript 외 등록일 25/04/11"
(주)한국스마트폰거래소,[풀스텍 개발자] WEB/APP 개발자 채용 (경력),"백엔드/서버개발, 앱개발, 웹개발, B2C 등록일 25/04/15"
(주)사이버다임,서버개발팀 웹클라이언트 개발자(경력),"CSS3, 반응형웹, 웹표준, 웹접근성, Javascript, ECMAScript 외 등록일 25/03/26"
에스코어(주),Openstack 클라우드 플랫폼 B/E 개발자,"백엔드/서버개발, 소프트웨어개발 수정일 25/04/04"
(주)아이서티,JAVA웹개발자(경력직) 채용,"iBATIS, MyBatis, Java, Spring, Ajax 외 수정일 25/03/28"
조베이스(주),[솔루션] 백엔드 개발자 모집(C#),"풀스택, Spring, Redux, Python, JSP 외 수정일 25/03/21"
이지케어텍(주),[의료IT 1위 이지케어텍] 풀스택 웹 개발자 채용,"유지보수, 풀스택, 헬스케어, Android, API 외 등록일 25/04/11"
㈜새롬정보시스템,"웹개발(JAVA, Node) 경력자 채용공고","Java, C++, C언어, .NET, 웹개발 외 수정일 25/04/04"
언커먼랩(주),웹/앱 프론트엔드 개발자 채용,"React, 블록체인, 스마트컨트랙트, 퍼블리셔, 풀스택 외 등록일 25/04/08"
(주)쓰리아이,SW 개발자 채용 (FrontEnd/MLOps/Computer Vision),"QA/테스터, iOS, Android, 앱개발, 소프트웨어개발 등록일 25/04/10"
(주)온메이커스,JAVA JSP 웹 개발 경력 개발자 채용,"Java, 앱개발, JSP, 웹개발, SM 수정일 25/04/15"
(주)스키아,서버/백엔드 개발자를 모십니다,"ASP.NET, Linux, Docker, 소프트웨어개발 등록일 25/04/14"
(유)넥스트씨아이코리아,Junior Backend 개발자,"MongoDB, NoSQL, PostgreSQL, 백엔드/서버개발, RestAPI 외 등록일 25/04/17"
( 주)투라인클라우드,Backend 개발자 모집 (경력),"백엔드/서버개발, 웹개발, 소프트웨어개발 등록일 25/04/01"
주식회사 셈웨어,"(주)셈웨어 Java 기반 웹 개발 경력자 채용(자바, 전자정부)","Java, MySQL, Javascript, Spring, SpringBoot 외 수정일 25/04/17"
(주)이지서티,"[이지서티]솔루션 플랫폼 개발자 경력(JAVA, C 등)","AI, 인공지능, Ajax, API, 클라우드, Java 외 수정일 25/04/17"
지앤아이소프트(주),[지앤아이소프트(주)] 서비스 웹 프론트엔드 개발자 모집,"CSS3, Javascript, 프론트엔드, HTML, HTML5 외 등록일 25/04/02"
(주)케이원피에스,PG 개발팀 개발자 팀원 모집,"Git, Java, MySQL, Vue.js, Jenkins 외 등록일 25/03/31"
(주)포도,웹개발자 모집,"백엔드/서버개발, 웹개발, 소프트웨어개발 등록일 25/04/02"
(주)이즈파크,[이즈파크] 디지털트윈 솔루션 개발자 채용,"클라우드, Java, 네트워크, Docker, C, 외 수정일 25/04/14"
(주)버블콘,(주)버블콘 Python 개발자(신입) 채용,"Python, 솔루션업체 수정일 25/03/31"
(주)인포인,[백엔드/서버개발] 백엔드 개발자 채용(차장급),"SI개발, S/W, React, AWS, Java 외 등록일 25/04/15"
잠보소프트,안드로이드 개발자 구인(신입및 경력집모집),"Java, 웹에이전시 등록일 25/03/19"
(주)미래로시스템,WEB 응용 소프트웨어 경력 개발자 채용,"아키텍쳐, Spring, SpringBoot, RestAPI, JSP 외 수정일 25/03/28"
(주)테크맥스,C#/.NET 기반 응용 프로그램 개발자 채용 - 테크맥스에서 함께.,"개발PM, Javascript, C, 기술지원, WPF 외 등록일 25/02/18"
한국전자인증㈜,iOS 개발자 경력 모집,"Objective-C, SI, 시스템통합 수정일 25/04/18"
(주)아이젝스,[(주)아이젝스] 서버개발자 / DBA 채용 공고,"DBMS, Java, Linux, C, C++ 외 등록일 25/03/31"
