company,position,skill
오비맥주,[ABInBev Korea 오비맥주] BEES Product Engineer,Access
와디즈,[와디즈] 자바 백엔드 개발 (병역특례/전문연구요원/전직),"Java, Spring, Boot, REST, API, AWS, Git"
이지식스(엠블),[TADA] QA Engineer,"JIRA, Github"
CLASS101,소프트웨어 엔지니어,"Java, Kotlin, Spring, Boot, MongoDB, AWS, Kubernetes, Docker, MySQL, React, Native"
(주)야나두,[야나두(야핏)] 안드로이드(AOS) 개발,"Kotlin, Java, MVVM, Jetpack"
(주)위펀,(주)위펀 - Backend Engineer,"Java, Spring, Boot, JPA, querydsl, REST, API, Linux, AWS, MySQL, MariaDB"
주식회사 파수,윈도우(Windows) 보안프로그램 개발자,"C, C++, Microsoft, Windows"
(주)플래스크,(주)플래스크 개발자 (Frontend Software Engineer) 채용,"reactjs, Nextjs, TypeScript, githubactions, Figma, frontend, reactquery, ssr, csr"
SK(주) C&C,DBMS(Oracle) 구축 담당 구성원 영입 (촉탁직),"Oracle, DBMSRDBMS"
콘센트릭스 Catalyst,글로벌 웹 분석 관련 개발자,"HTMLCSS, JavaScript, Google, Analytics, JSP"
21세기전파상,시니어 개발자,"Git, Github, AWS, MySQL, SQL, React, Native, JavaScript, Nodejs"
(주)야나두,[야나두] 프론트엔드 개발 (React),"React, Nextjs, JavaScript, TypeScript, Redux, Vuejs"
메이븐클라우드서비스 주식회사,데이터엔지니어/PM,"sqlquery, R, Python"
(주)모카시스템,임베디드 펌웨어 개발자,"Linux, C, C++, Qt"
휴레이포지티브,머신러닝 개발자,NLP
씨드앤,데이터 엔지니어 (3년 이상),"Java, Kafka, AWS, Azure, Linux"
21세기전파상,프론트엔드 개발자,"Git, Github, MySQL, SQL, React, Native, JavaScript, Nodejs, AWS"
맨파워그룹코리아,데이터 엔지니어,"Python, R, React, Nodejs, Azure, MSSQL"
빅웨이브로보틱스(주),로봇 통합 관제 시스템 프론트엔드 개발자 (5년 이상),"AWS, devops, React, Firebase, GitHub, SQL, Redis, Flutter, Git, JUnit"
콘센트릭스 Catalyst,SAP Hybris 개발자,"Spring, Java"
SK(주) C&C,SAP BASIS 모듈 컨설턴트 영입,
(주)오메타,안드로이드 개발자,"Android, Java, Kotlin, MVC"
스팬딧,백엔드개발자,"Ruby, on, Rails, Java, Spring, Boot, AWS, JPA, Github, MySQL, PostgreSQL"
(주) 딥노이드,데이터 엔지니어,"Python, airflow, Git, Apache, Spark, Kafka, PostgreSQL"
브랜디,데브옵스 엔지니어 (DevOps Engineer),"AWS, Python, bash, Terraform, infrastructure, helm"
(주)에이티앤피파트너즈,백엔드 개발자 경력 2년 이상,"Java, Spring, Boot, PostgreSQL, Redis, JPA, querydsl, Linux, AWS, IntelliJ, IDEA, GitHub"
와탭랩스,백엔드 에이전트 개발자(Golang),"GO, SQL, DBMSRDBMS, MSA"
(주)딥브레인에이아이,"[딥브레인 AI] 개발자(Front, Back) 및 PM 채용의 건","JavaScript, TypeScript, Nodejs, Nextjs, Express, MongoDB, React, Figma"
주식회사 유니유니,[주식회사 유니유니] ‘개발 리드’ 채용,"Java, React, Github, Nodejs, AWS"
패스트뷰,백엔드 개발자 (5년 이상),"AWS, Nodejs, Kotlin, Spring, PHP, Confluence, Java, Boot, MySQL"
(주)캐처스,Javascript / Typscript 개발,"JavaScript, TypeScript"
(주)GC케어,HIS System 개발 및 운영,"C#, DBMSRDBMS, MSSQL"
세나클소프트,[경력] Windows Client(C# WPF) 개발,"C#, NET, Git, wpf"
콘센트릭스 Catalyst,이커머스 개발자,"JavaScript, Java, SQL"
센트비,Backend Engineer (Go),"Go, grpc, PostgreSQL, Redis, Git, Docker, argocd"
(주) 미스터카멜,DevOps Engineer,"C#, Selenium, Elasticsearch, Redis, MySQL, AWS"
클라코퍼레이션,백엔드 개발자,"JavaScript, TypeScript, NestJS, MySQL, Redis, AWS, amazonopensearch"
(주)캐시멜로,핀테크기업 [캐시멜로] 백엔드 개발자 채용 (경력3년 이상),"MySQL, Redis, springdatamybatis, Spring, Boot, Java, JPA"
(주)모카시스템,[4.5일제] 안드로이드 개발자 모집,"JavaScript, Kotlin, Swift"
(주)다날,다날 결제시스템 FE개발 경력 채용,"HTMLCSS, React, Vuejs, JavaScript, Spring, PHP, Python"
빅웨이브로보틱스(주),로봇 통합 관제 시스템 백엔드 개발자 (5년 이상),"AWS, Kotlin, devops, Redis, Linux, JUnit, Firebase, Flutter, React, GitHub"
콘센트릭스 Catalyst,이커머스 개발 PM/PL,"Java, Oracle, Spring"
(주)디에스랩글로벌,백엔드 개발자,"FastAPI, Django, AWS, Azure, Docker, Kubernetes, DBMSRDBMS"
(주)위펀,(주)위펀 - Frontend Engineer(React),"JavaScript, Git, SEO, ux, HTMLCSS, TypeScript, Vuejs, React, Framer, GUI"
인프랩 (인프런),[인재풀] 전 직군,"MSOffice, Slack"
중고나라,SRE DevOps 엔지니어(경력),"AWS, Kubernetes, Terraform, helm, GitHub, Docker, container, devops, cloudcomputing, CICD"
(주)에이티앤피파트너즈,프론트엔드 개발자 경력 2년 이상,"React, Nodejs, TypeScript, Nextjs, awsec, nginx, githubactions, Figma"
(주)팜존에스엔씨,[팜존에스엔씨] JAVA 시니어(4년) 경력 개발부문 채용,"JavaScript, Java, MySQL, JSP, MSSQL, Oracle"
리빌더AI,AI 개발자 모집,"Stable, Diffusion, LLM"
데이터메이커,프론트엔드 개발자,"JavaScript, ES, Rust, Vuejs, Nuxtjs, Threejs, Github, Notion, Jetbrains, ChatGPT"
베링랩,프론트엔드 개발자,"React, TypeScript, Nextjs, frontend"
휴머스온,통합 메시징 및 AI 기반 서비스 개발자,"Spring, Boot, MySQL, Oracle, Redis, Kafka, Java, REST, API, AWS, Google, Cloud, Platform, Azure"
데이터메이커,ML Engineer,"Python, PyTorch, Keras, ScikitLearn, Github, Notion, Jetbrains, ChatGPT"
주식회사 바텍,DevOps 개발자 모집 (재택근무/판교 오피스 근무 가능),"DevOps, Kubernetes, Kafka, Elasticsearch, Jenkins, Github, Docker, AWS"
(주)크라우드웍스,[크라우드웍스] AI플랫폼팀 Full-stack 개발자(Junior),"Java, Python, https, restful, Linux, LLM, RAG"
리빌더AI,프런트엔드 개발자,"JavaScript, Java, HTMLCSS, TypeScript"
(주)컨두잇,백엔드 개발자,"Java, Spring, Boot, PostgreSQL, JPA, AWS, JUnit, Mockito, Git"
CLASS101,백엔드 개발자,"Java, Kotlin, Spring, Boot, Kubernetes, TypeScript, Nodejs"
크몽,Backend Kotlin Developer (5-12년),"Kotlin, Java"
콘센트릭스 Catalyst,Adobe AEM 개발 전문가,"JSP, Java"
효성에프엠에스,효성에프엠에스 백엔드 개발자채용,"Python, AWS, TDD"
와탭랩스,데브옵스 엔지니어(DevOps Engineer),"AWS, Shell, Script, Java, Kubernetes"
브랜드 인게이지먼트 네트워크 인크,AI 음성 인식 개발자,"Swift, Docker, websockets, grpc, rabbitmq"
오비맥주,Data Sr. Engineer,"Python, SQL, Java, AWS, Azure, Google, Cloud, Platform"
베링랩,NLP 개발자,"NLP, PyTorch, transformer"
SK(주) C&C,[SK(주) C&C 자회사_Ackerton Partners] ERP 컨설턴트 모집(정규직),IT
(주)블록체인글로벌,시니어 백엔드 개발자(과장급/7년 이상),"Java, Spring, MySQL, Kotlin, backend, Kubernetes"
코웨이(주),[코웨이] ERP팀(SAP컨설턴트) 경력직 채용,HR
이수시스템,[이수시스템] 인사솔루션 개발자,"Java, JavaScript, Oracle, JSP, Spring, Vuejs"
21세기전파상,백엔드 개발자,"Git, Github, MySQL, SQL, React, Native, JavaScript, Nodejs, AWS"
런치팩 주식회사,[런치팩] 테마 프론트엔드 개발(시니어),Vuejs
(주)써머스플랫폼,[스마트택배] 스윗트래커CIC_인프라 담당 채용,"AWS, Linux"
테이퍼랩스,Front-end Engineer,"Swift, Flutter, Python, openai, NLP, AI"
(주)비와이엔블랙야크,[BYN블랙야크] IT 부문 경력직 상시 인재 pool 등록,"Java, AWS, React, SQL, Spring, Boot, Nodejs, MySQL, Docker, Kotlin, Vuejs"
이지케어텍(주),[의료IT] 인프라 엔지니어 경력 채용,"Microsoft, Windows, Linux"
브랜드 인게이지먼트 네트워크 인크,AI 음성 합성 개발자,"Swift, Docker, websockets, grpc, rabbitmq"
HB TECHNOLOGY,Computer Vision(2D/3D) SW개발,"OpenCV, C, C++, mlops, CUDA, Python"
스윗코리아,프론트엔드 개발자 (Front-end Developer),Angular
하이프로토콜,[Web3] 크로스체인 프로토콜 백엔드 시니어 개발자 채용,"TypeScript, Express, DBMSRDBMS, PostgreSQL, AWS, awsserverless, Redis, websockets"
안전성평가솔루션(주),"JAVA, 프론트 & 백엔드 선임 개발자(정규직)","Java, Spring, Boot"
소명소프트(주),중급 JAVA 개발자  인재채용,"Java, JSP, SQL, Spring, MySQL, MariaDB, Github"
데일리펀딩,프론트엔드 개발자,"React, Java, HTMLCSS, Git, TypeScript, Sass, Nextjs"
(주)디에스랩글로벌,데이터 분석가,"Python, Google, Analytics, Firebase"
콘센트릭스 Catalyst,데이터분석가,"Google, Analytics, Python, SQL"
맨파워그룹코리아,데이터 사이언티스트,"Python, R, Azure, Bootstrap, Principle"
휴레이포지티브,프론트엔드 개발자 (Lead),"TypeScript, Tensorflow, JavaScript, React, vue, Angular"
(주)쓰리뷰,프론트엔드 개발자 모집,"C#, NET, MSSQL, MySQL, Java, Swift, Flutter"
(주)리코,Sr. Developer,"Vuejs, TypeScript, Kotlin, Spring, Boot, JPA, querydsl, AWS, Docker, junit"
(주)윙크스톤파트너스,웹 퍼블리셔,"HTMLCSS, JavaScript, jQuery, VSCode, Git, Figma"
이지식스(엠블),[TADA] Android Engineer,"Kotlin, Android, MVVM, RxJava"
인라이플,Java개발 팀장,"Java, Vuejs, api, MySQL, Spring, Boot, mybatis, MariaDB"
베링랩,리드 NLP 개발자,"NLP, transformer, PyTorch, LLM"
(주)스플랩,[인재풀] Backend Developer,"Java, Kotlin, Spring, Boot, JPA, JUnit, AWS, MySQL, Redis, GitHub"
주식회사 원더베리,소프트웨어 엔지니어,"C, C++, Unity, Unreal, Engine"
주식회사 브룩허스트거라지,Full Stack Software Engineer,"REST, API, React, Vuejs, JavaScript, robot, Python, C, C++"
데일리펀딩,백엔드 개발자,"Python, MySQL, PostgreSQL, REST, API, Github, PHP"
(주)다날,다날 결제시스템 BE개발 경력 채용,"Java, springframework, Spring, Boot, Batch, REST, API, MySQL, MSSQL, PostgreSQL"
(주)디에스랩글로벌,프론트엔드 개발자,"React, HTMLCSS, iOS, Android, Git"
(주)캐처스,React/React Native 개발,"JavaScript, TypeScript, React, Native, webgl"
버터소프트 주식회사,백엔드 개발자,"Java, Kotlin, Spring, Boot, PostgreSQL, MySQL, JPA, querydsl, Docker, Git"
(주)딜러타이어,B2B B2C 서비스 앱 개발자,"React, Native, reactquery, zustand, Git"
Enssel,[채용공고]Enssel2023 부분별 개발자 정규직 채용,Python
(주)탄소중립연구원,[전환형 인턴] 탄소회계 솔루션 웹 프론트엔드 개발자,"Vuejs, React, GraphQL, TypeScript"
런치팩 주식회사,"[런치팩_풀스택] 테마, 서비스 부분수정 개발(리드급)","Vuejs, Django"
주식회사 사각,AI Researcher/Data Scientist(경력 2년 이상),"Python, Tensorflow, PyTorch, LLM, SQL"
(주)알로카도스,React-Native 스태프 엔지니어,"React, Native, TypeScript, Swift, ObjectiveC, Kotlin, JavaScript, Java"
(주)누아,웹(Web) 백엔드 개발자,"Java, springframework"
와탭랩스,백엔드 에이전트 개발자(Node.js),"Nodejs, SQL, DBMSRDBMS, MSA"
뷰메진,[뷰메진]로보틱스 엔지니어 Lead (경력 3년 이상),"Linux, C++, Git, Python"
해줌,데이터사이언티스트,"Python, Tensorflow, PyTorch, R, Tableau"
(주)크라우드웍스,[크라우드웍스] AI솔루션팀 Full-stack 개발자,"Python, Java, JavaScript, React, RAG, Linux"
빌드코퍼레이션,[개발] Backend Developer,"AWS, GitHub, Nodejs, Nextjs"
주식회사 트라이포드랩,트라이포드랩에서 함께 성장해나갈 리드 개발자를 모십니다.,"Java, Spring, Boot, NestJS, React, AWS, DBMSRDBMS"
마이플레이컴퍼니,개발팀 리더,"Python, DjangoRESTFramework, Django, AWS, awsec, Lambda"
휴머스온,Backend Engineer(메세징 서비스 기술 운영),"Linux, MySQL, Oracle"
텔레픽스 주식회사,백엔드 개발자,"Python, JavaScript, FastAPI, PostgreSQL, MongoDB, Redis, AWS"
(주)디랙스,DB 모델러 모집,"modeling, DBMSRDBMS, MySQL, querytuning"
(주)필라넷,(주)필라넷 생성형 AI 애플리케이션 개발자 채용,"Python, Nodejs, TypeScript, Azure, AI, Teams, Microsoft, Copilot"
주식회사 파워테스크,클라우드 엔지니어 / DevOps 엔지니어,"devops, cloudplatform"
(주)알로카도스,시니어 파이썬 백엔드 엔지니어,"AWS, Django, Docker, Flask, FastAPI, MongoDB, Kubernetes, Redis, MySQL"
한솔코에버주식회사,RPA 구축 및 유지보수 담당자 모집,"UiPath, Python, VBA, C#"
코코네 M,(Cocone M)  SRE엔지니어 (Site Reliability Engineering),"AWS, Docker, CICD, Jenkins"
브이아이펫,[재택근무 주1회]펫VIP(브이아이펫)React Native 개발 가능한 풀스텍개발자 모집,"React, Native, Java, JavaScript"
(주)엔블리스컴즈,안드로이드 앱 개발자,"Kotlin, Java, Swift"
(주)브리치,[비플로우] 백엔드/서버 개발자,"PHP, JavaScript, Python, Nodejs, Spring, Boot, AWS"
(주)스플랩,[umoh] 데이터 라벨링 & 리서치 인턴 모집 🚀,"Excel, Google, Sheets, Python, SQL, Apps, Script"
룰루랩,[룰루랩] 서버/백엔드 개발자,"Java, Kotlin, devops, mlops"
디오코,의료용(치과) 3D SW 개발자 채용,"C++, mfc, OpenGL"
SK(주) C&C,[SK(주) C&C 자회사_Ackerton Partners] DT 컨설턴트 모집(정규직),"IT, dt"
스팬딧,시니어 백엔드 개발자,"Ruby, on, Rails, Java, Spring, Boot, AWS, JPA, Github, MySQL, PostgreSQL"
주식회사 유니유니,[주식회사 유니유니] ‘AI 개발자’ 채용,"AI, Python"
데이터메이커,백엔드 개발자,"Django, Python, drf, PostgreSQL, Redis, Git"
아파트아이,프론트엔드 개발자 (React.JS_주니어),"RxJS, React, NET, Vuejs, DBMSRDBMS, jQuery"
주식회사 왈라,[패션 스타트업 WALA] 개발팀 리드(팀장급),"AWS, backend, Google, Cloud, Platform, Java, MySQL, mysqlquery, JPA, Spring, Boot, Python"
링크루트,[경력] 백엔드 엔지니어,"Python, Django, djangocelery, Redis, Docker, Kubernetes, PostgreSQL, Java, springframework"
뷰메진,[뷰메진]컴퓨터비전 엔지니어 Mid / Senior (경력 3년↑),"Linux, OpenCV, Python, Git, Docker, PyTorch, Tensorflow, Github"
아파트아이,프론트엔드 개발자 (React.JS_주니어),"RxJS, React, NET, Vuejs, DBMSRDBMS, jQuery"
(주)트레블씨투비,"모바일 앱 개발자(Android, iOS)","Kotlin, Swift, Git, GitHub, iOS, Android"
주식회사 메가인포아이티,Frontend 개발자(3년이상),"AWS, HTMLCSS, GitHub, JavaScript, React"
(주)엔블리스컴즈,백엔드/서버 개발자,"AWS, MySQL, Spring, Boot, BackEnd, Web, API"
씨드앤,프론트엔드 리드 개발자 (6년 이상),"TypeScript, HTMLCSS, Redux, React, Native"
SK(주) C&C,"제2금융권(보험,증권) 서버 운영 업무 수행 구성원 영입","Windows, Server"
SK(주) C&C,"제2금융권(증권, 보험) Middleware 운영 업무 수행 구성원 영입 (촉탁직)","apachetomcat, nginx"
주식회사 네일톡톡,앱 리드 개발자 채용,"Flutter, dart, iOS, Android"
장가 컴퍼니,"PHP 개발자 / fastAPI 개발 (경력무관, 4000이상)","PHP, Python"
(주)오메타,iOS 개발자,"iOS, Swift, Java, MVC"
하나투어,DBA 경력직원 채용 공고,"Oracle, PostgreSQL, MariaDB"
플릭,Founding ML Engineer,"AI, Agent, LLM, PyTorch"
(주)패스트레인,프론트엔드 개발자,"JavaScript, TypeScript, React, Nextjs, zustand, reactquery, Git, githubactions, Figma, JIRA"
주식회사 페칭,[페칭] 패션 플랫폼 React 프론트엔드 개발자 경력직,"React, Native, nextjs, tailwindcss, Redux"
휴머스온,Sr. Backend Engineer,"backend, Java, springframework, REST, API, api, Spring, Boot, programminglanguages"
이수시스템,[이수그룹] IT기업 MS365 담당 및 네트워크 운영자 함께 해요!,"Teams, MSOffice"
주식회사 파워테스크,AI Engineer,"LLM, Python, RAG, AI, Agent"
(주)팜존에스엔씨,[팜존에스엔씨] JAVA 주니어(1~3년) 경력 개발부문 채용,"JavaScript, Java, MySQL, JSP, MSSQL, Oracle"
도시미래시도,AI 온라인 교육 프로젝트 멘토,"Azure, AI"
TIM Robotics,React.JS (Next.JS) 프론트엔드 엔지니어,"reactjs, Nextjs, TypeScript, TypeORM"
올거나이즈코리아주식회사,[AI Startup] 파이썬 백엔드 엔지니어,"Docker, Django, Python, Keras"
(주)알로카도스,시니어 클라우드 인프라 엔지니어,"AWS, Terraform, Ansible, Django, Docker, Flask, FastAPI, MongoDB, MySQL, Kubernetes"
애자일,프론트엔드 개발자,"JavaScript, Vuejs, Java, JSP, Jira, Cloud, confluence, cloud"
센트비,Backend Engineer (Java/Kotlin),"Kotlin, Java, Spring, Boot, springframework, JPA, Docker, Kubernetes, Git, GitHub, AWS"
(주)다날,다날 테스트 자동화 개발 담당 경력 채용,"Python, Java"
솔로트립,"프론트엔드 개발자 (React, React.Native)","React, Native, GraphQL"
룰루랩,[룰루랩] AI개발자 (3D 피부분석),"Python, PyTorch"
마야크루,백엔드 개발자,"expressjs, Nodejs, JavaScript, TypeScript, REST, API, MySQL, MongoDB, AWS, Docker, Kubernetes"
올거나이즈코리아주식회사,[AI Startup] 데브옵스 엔지니어,"Docker, Python, Linux"
21세기전파상,개발 총괄 [CTO],"Git, Github, AWS, MySQL, SQL, JavaScript, React, Native, Nodejs"
베링랩,백엔드 개발자 (Rust),"Rust, Python, devops, backend, CICD, MSA, Kubernetes"
리빌더AI,[리빌더AI] 백엔드 개발자 모집,"Java, Spring, DBMSRDBMS"
브랜디,프론트엔드 개발자 (Front-end Developer),"Java, JavaScript, Nodejs, REST, API, Nextjs, Vuejs, TypeScript, Webpack"
사이벨 헬스 (주),[Sibel Health] 사이벨헬스 QA엔지니어 채용 (경력),
엑세스 주식회사,프론트엔지니어 개발자(시니어/미들),"JavaScript, Kotlin, Java, reactjs, Vuejs, Angular, TypeScript, Nextjs, Jetpack"
콘센트릭스 Catalyst,GA/AA 데이터 분석가,"Google, Analytics, SQL"
해킹그로스길드,시니어 솔루션 엔지니어 채용,"mixpanel, GA, Amplitude, Google, Analytics, Tag, Manager, iOS, Android, Python"
(주)캐시멜로,핀테크 기업 [캐시멜로] DevOps 개발자 채용(경력 3년이상),"Kubernetes, Java, Spring, Boot, Docker, Prometheus"
(주)에스아이에이,DevOps Engineer (3년 이상),"Terraform, helm, Kubernetes, eks, AWS, Google, Cloud, Platform, PostgreSQL, Redis, githubactions"
피벗 주식회사,NestJS 개발자,"JavaScript, TypeScript, Nodejs, NestJS"
(주)크라우드웍스,[크라우드웍스] AI플랫폼팀 Full-stack 개발자(Senior),"Java, Python, LLM, RAG, Docker"
(주)트루엔,FW(펌웨어) 경력 개발자 집중 채용 (3년 이상),"REST, API, C++, C, Linux, MySQL"
(주)캐처스,Ruby On Rails 개발,"Ruby, on, Rails"
(주)뷰런테크놀로지,시스템 SW 엔지니어,"C, C++, Qt, tcpip, multithread"
주식회사 다이노즈,React / Next.js 웹개발자 (경력 2년 이상),"React, Nextjs, TypeScript, HTMLCSS, Firebase, Git, GitHub, githubactions"
찾아줘부동산,프롭테크 웹서비스 개발 리딩,"Java, Spring, Boot, JPA, MariaDB"
인텔렉투스,Backend(API) SW Engineer,"TypeScript, serversidejavascript, database, DBMSRDBMS, AWS, Google, Cloud, Platform, awsserverless"
누리미디어,[개발운영] 네이티브 앱 개발자 (경력),"Flutter, ObjectiveC, Swift, swiftios, iOS, Java, Kotlin, C++, C#, NET"
(주)엠앤디,"웹개발 - 백엔드 ( Python, FastAPI, Pandas, Docker )","Python, FastAPI, Pandas, Docker, pytest, PostgreSQL, SQLAlchemy, Kafka, Kubernetes"
(주)뷰런테크놀로지,Perception Engineer,"C, C++, Python"
(주)다날,다날 결제시스템 서버개발자 증원 채용 - 성장하는 팀과 함께할 동료를 찾습니다,"Java, Spring, Boot, springframework, Batch, JPA, Docker, elk, MySQL, MSSQL, PostgreSQL"
(주)크라우드웍스,[크라우드웍스] 데이터플랫폼팀 Full-stack 개발자,"vue, React, TypeScript, css, Nuxtjs, nextjs, Sass, Java, Spring, Boot, Git"
오드컨셉주식회사,데이터 엔지니어,"JavaScript, HTMLCSS, React, Vuejs, Git, Python"
하이프로토콜,[Web3] 크로스체인 프로토콜 프론트엔드 시니어 개발자 채용,"TypeScript, React, Redux, reactquery, Nextjs, websockets"
주식회사 페칭,[페칭] 패션 플랫폼 Node.js 백엔드 개발자 경력직,"Nodejs, TypeScript, NestJS, MySQL, awsrds, rabbitmq, Nextjs, React, Native"
와탭랩스,백엔드 에이전트 개발자(C&C++),"C, C++, SQL, DBMSRDBMS, MSA"
브이피피랩,Data Scientist 경력 채용,"Python, Tensorflow"
한솔코에버주식회사,JAVA 개발자 경력직 채용,"Java, Vuejs, JPA, Spring, Boot"
(주)올리브헬스케어,윈도우용 의료기기  SW 개발자 채용,"C++, C#, wpf, GUI"
(주)탄소중립연구원,[전환형 인턴] 탄소회계 솔루션 웹 백엔드 개발자,"Nodejs, NestJS, DBMSRDBMS, NoSQL, MariaDB, PostgreSQL, MongoDB"
해줌,프론트엔드 개발 팀장,"HTMLCSS, JavaScript, React, Vuejs"
(주) 딥노이드,백엔드 개발자,"Java, Spring, Boot, JPA, NoSQL, MongoDB, Kotlin, Kafka, Kubernetes"
패스트뷰,DevOps Engineer (3년 이상),"AWS, bitnami, Shell, Script, PHP, Python"
(주)원더라운드,여행 플랫폼 WOKA Frontend 개발자,"AWS, HTMLCSS, Git, JavaScript, Nodejs, TypeScript, React"
플루토스디에스 주식회사,프론트엔드 개발자,"React, Angular, Vuejs, HTMLCSS, JavaScript, Redux, MobX, Git, Nextjs, TypeScript"
스테이지랩스,모바일 App,"React, Native, TypeScript, REST, API, swr, Redux, Git, Github"
(주)바틀,웹 크롤러 개발 전문가 Java script 또는 Python,"JavaScript, Python, Java"
커넥션스튜디오,프론트엔드 개발자,"React, TailWindCSS, JavaScript, TypeScript, reactquery, Redux, zustand, GitHub"
휴스테이션,프론트엔드 개발자,"React, HTMLCSS, JavaScript, JIRA"
미리디,[커머스프로덕션] Jr. QA 엔지니어,"Slack, Confluence, JIRA"
빅테크플러스,[빅테크플러스] 풀스택 개발자 채용,"Java, Kotlin, TypeScript, JavaScript, React, CICD, DBMSRDBMS, springjpa, ORM"
(주)애즈랜드,프론트엔트/백엔드,"PHP, JavaScript, jQuery, Ajax, MySQL"
아파트아이,JAVA 백엔드 (대리급) / 5~8년,"Java, Spring, JavaScript, jQuery"
사이벨 헬스 (주),[Sibel Health] 사이벨헬스 클라우드/백엔드 엔지니어 채용 (경력),"Python, AWS, React, JavaScript, Git, CICD, Shell, Script, MySQL, SQL"
플릭,Founding Backend Engineer,"TypeScript, AI, Agent, Google, Cloud, Platform, cursor, RAG"
TIM Robotics,Robotics SLAM & Navigation 엔지니어,"C++, ros, slam, Python, Git"
프록시펙토리,프론트엔드 개발자,"React, Native, HTMLCSS"
더블디,[더블디] NodeJS/Spring 백엔드 개발자 채용 공고,"Nodejs, Spring"
주식회사 서큘러스,SW개발자 채용,"React, tailwindcss, Nodejs, MongoDB, Python, GitHub, JavaScript"
주식회사 젠스타파트너스,Back-end Engineer (5년 이상),"TypeScript, NestJS, JavaScript, MongoDB, Docker, GraphQL, AWS"
피벗 주식회사,React 개발자,"React, reactjs"
와탭랩스,솔루션 엔지니어 / IT 성능 컨설턴트,"Java, AWS, Kubernetes"
센트비,QA,"QA, postman, JIRA, Confluence, Slack"
빅테크플러스,[빅테크플러스] 웹크롤링 (스크래핑) 엔지니어 채용,"Python, infrastructure, api"
(주)인터프로커뮤니케이션,[인터프로인디고] 웹 사이트 개발자 모집,"PHP, HTMLCSS, JavaScript"
주식회사 코아메소드,(주)코아메소드 웹개발 경력직 모집,Java
휴머스온,AI 개발자(ML/Deep Learning/생성형 소재),"Tensorflow, PyTorch, DBMSRDBMS, NoSQL, MySQL, MongoDB, AI"
주식회사 제로엑스플로우,Frontend Engineer(5년 이상),"React, JavaScript"
텔레픽스 주식회사,AI NLP딥러닝 엔지니어,"LLM, multimodal, RAG, Python, AWS, Google, Cloud, Platform, Azure, vectordatabase, LangChain, Docker"
더블디,"[더블디] ESP32 펌웨어, 회로설계 개발자 채용 공고","C, Python"
안전성평가솔루션(주),"JAVA, 프론트 & 백엔드 개발자 팀장급(정규직)","Java, Spring, Boot, Vuejs"
주식회사 비피엘파트너스,구독형 버티컬 인재 매칭 플랫폼,"Flutter, Firebase, Git, JIRA"
(주)모카시스템,웹 프론트엔드 시니어 개발자 모집,"JavaScript, React"
주식회사그로잉랩,백엔드 시니어 개발자,"Nodejs, MySQL, AWS, Github"
(주)디랙스,AWS 소프트웨어 개발자 모집,"Java, Spring, MySQL, AWS, Android, iOS, JSP"
휴레이포지티브,안드로이드 개발자(경력),"RxJava, Jetpack, Kotlin, Java, Android"
(주)캐처스,Python 개발,"Python, JavaScript, TypeScript, Ruby, Elasticsearch, PostgreSQL"
(주)탄소중립연구원,[Net-Zero 선도기업_탄소중립연구원]서비스 운영 지원 백엔드 개발자,"JavaScript, TypeScript, Nodejs, NestJS, ORM, Prisma, TypeORM, PostgreSQL, Docker, awsec"
주식회사 비웰코리아,[일본 취업] SoftBank Corp. 2026년 4월 입사 신입 채용,"mlops, Kaggle, AI"
(주)아이비스,"Embedded SW개발 C++,C 개발자 모집","C++, C, Linux"
휴머스온,Service Engineer(SM/운영),"Sass, CX, JIRA, database, Java"
(주)퍼브,(주)퍼브 솔루션개발팀 개발자 정규직 채용,"Java, JavaScript, SQL"
아하앤컴퍼니(주),[아하] 프론트엔드 엔지니어,"Nodejs, NestJS, TypeScript, SEO"
클라썸,QA 인턴,"Google, Sheets, Figma, SQL, postman"
씨드앤,백엔드 개발자 (5년 이상~10년 이하),"JavaScript, Java, Nextjs, NestJS, expressjs"
(주)드래프타입,웹/프론트엔드 개발자 (3년 이상),"Git, GitHub, AWS, TypeScript, HTMLCSS, JavaScript, REST, API, swagger"
(주)두비스,"신입직원 - 웹/앱 프로그래머, 응용프로그래머","Android, iOS"
씨드앤,백엔드 개발자 (3년 이상~5년 미만),"JavaScript, Java, AWS, Azure, Nextjs, NestJS, expressjs"
뷰메진,[뷰메진]컴퓨터비전 엔지니어 Lead (경력 5년↑),"Linux, OpenCV, Python, Git, Docker, PyTorch, Tensorflow, Github"
(주)큐피스트,백엔드 개발자 (Node.js),"Nodejs, backend"
(주)코딧,QA 매니저,QA
(주)에스아이에이,Cloud Engineer (3년 이상),"Linux, GPU, grafana, Prometheus, argocd, Docker, Kubernetes"
ms인포테크,iOS 개발자 채용,"iOS, swiftios, Autolayout, Git"
